customer_id,customer_name,email,phone,complaint_type,complaint_text,created_at,status,priority
4decd503-ca30-4c53-a4a3-2efbc476c394,Joan Williams,denise84@example.org,+1-988-638-9085x6964,Disconnection issue,Imagine party picture total. Follow issue movie hair position case expect why.,6/10/2025 22:36,In Progress,Critical
c006be02-3ed0-41a5-a5f5-29ce50afad93,Donna Long,keithcollins@example.org,+1-516-267-2557x6267,Slow speed,Door tend try change. Security thought game use.,6/26/2025 18:38,Closed,Critical
1ce859cb-a2cc-47ad-bae7-49b881a299b2,Thomas Boyd,karen23@example.org,5804015891,Wrong charges,Question light new plant hospital magazine choice. Month arrive local turn mother write. Wonder bring item follow.,1/7/2025 5:48,Closed,Low
3efa0299-33bd-4698-88f2-8fe178662a53,Christopher Knox,donaldbowman@example.com,+1-486-933-1150x6990,Disconnection issue,Collection oil fine experience role tree. Pattern career loss believe thank drive friend. Team thousand season very great something.,6/4/2025 13:36,Resolved,Low
e8ca1232-6803-4a72-8859-dc8cc9f4be28,Edwin Hess,rhondastevens@example.net,001-864-233-1307x8382,Customer support delay,Visit detail guy know fish. Far price off business. Dark hit far her follow. Foot great authority strategy level quality.,3/25/2025 1:05,Resolved,High
fb32890a-ef6d-4f95-a928-f6965a0861f2,Rebecca Decker,gcastillo@example.net,+1-751-625-8518x884,Customer support delay,Republican drug read sell either industry skin fight. Three science or born some.,6/23/2025 5:51,Open,Critical
9b4d6843-c399-498b-b9d6-8606dd08bf72,Danielle Taylor,monicaknox@example.net,001-546-236-6114x9360,Customer support delay,Difficult ok anything camera item crime. Check letter clear state public together room. Against lawyer short south program identify theory. Herself yeah help daughter accept do lead.,1/28/2025 13:26,In Progress,Low
cfb5dd16-7546-4eb1-b5dd-4eef2d2829b8,Krystal Parks,rachaelwalker@example.net,842.309.1482x292,Service downtime,Certain partner national. Continue trouble individual yourself officer today.,4/13/2025 15:21,Resolved,Critical
283d4e99-0e2a-4ce0-87e3-7bb6583949d1,Priscilla Oneill,scottburch@example.org,737.980.0745,Internet not working,Purpose bill newspaper work road. Message sell attack data home our. Thing building crime push something another.,3/29/2025 17:21,In Progress,High
02db7c19-9335-4016-89a7-61e3d848e3d9,Anthony Maldonado,crystal41@example.net,(360)409-2671,Customer support delay,Agreement job let peace none read. About simple put throughout bring full. Remain whether unit product.,4/9/2025 2:35,Resolved,Medium
4419074a-0fd9-4904-9e30-d6add58e314e,David Parker,caitlinbrown@example.org,276-803-4411,Service downtime,Draw its contain college nation. Available and president assume arm hope. Live check investment where half.,6/9/2025 16:25,Resolved,Medium
2ce9fdc8-ee27-4c69-84db-404a51d6ce3d,Bonnie Keller,michaelclark@example.net,355.822.9891x026,Disconnection issue,Full right newspaper important. Finally size almost throw clear machine.,1/25/2025 20:05,Resolved,Low
2da44f52-b637-4f39-886a-744dc62661c2,Jean Frank,cmiles@example.org,9068250973,Disconnection issue,Process role ask yet trade. Clearly cover reach. Very far with store draw.,4/2/2025 22:01,Resolved,High
edf35b87-c613-4b89-a98f-bda99134133f,Penny Long,henrythomas@example.net,-9320,Billing issue,Inside society other standard. Where let deal college doctor four. Arrive me main door medical.,4/28/2025 8:13,In Progress,Low
77ee0fb2-21a4-4dce-b928-3a0e2c6908a8,Todd Obrien,kgreen@example.net,638.588.9692,Internet not working,Soldier stand part game or represent any. Kitchen address himself it issue.,4/11/2025 2:41,Open,High
e84c007c-08f7-4ccc-a19f-dc8c438c3578,Tara Kaiser,umcdaniel@example.org,+1-631-449-9983x29966,Installation pending,Water rule have month million home shake appear. Difference positive still good term new paper risk.,2/2/2025 6:59,Open,Low
a4ca2c30-02a1-4110-8b69-041c33bc33f5,Richard Rush,kennedydeborah@example.com,-3450,Disconnection issue,Miss certainly customer turn finish. Key not kitchen future floor.,1/13/2025 3:02,Resolved,Low
f8049dcd-6c1c-40ac-b25f-70e2aa791ff6,Douglas Dawson,david30@example.com,(579)697-5483,Wrong charges,Or moment image forget general trouble time. Lose center without any church. Reduce floor available.,4/10/2025 3:51,Open,Low
474b8765-3819-46e2-b17c-b62c73dc2191,Joseph Collier,joe54@example.org,979-800-8573x12533,Internet not working,See item thank state third attorney. Benefit whole training debate. Talk strong others world student.,2/11/2025 6:29,Resolved,Low
591cfc36-5c42-4a5c-87c3-be48a37dbb41,Carol Compton,jessicarice@example.com,991-957-3020x91047,Wrong charges,Per main party general. Source kitchen me.,4/8/2025 19:09,Resolved,High
876c98d1-b565-47bc-a1cd-1d59f610b8a9,Joy Jenkins,jadams@example.org,001-275-670-9485,Router problem,Drop fact move current. Market site program sound.,4/10/2025 6:06,Resolved,High
d91c3591-0d2f-4179-a49e-c95d6130e3f4,Brian Blair,danielle21@example.net,001-247-965-5737,Connection drops,Discuss door while once modern trial coach along. Me president product when owner fly star. Away brother their.,1/30/2025 5:35,Closed,High
87ad9634-5adf-43ec-a415-b8c162af5cf9,Maria Torres,carteramanda@example.com,(906)513-1700,Billing issue,Whole north leader surface democratic ago mission. Day town shoulder.,3/4/2025 6:17,Open,Critical
527eec96-3183-4d50-bf65-74c67f8a4ff2,Tammy Lopez,zcortez@example.net,+1-330-476-4814x43719,Router problem,Say despite situation alone medical or. Fish direction ok include career ground. Class generation on start.,3/20/2025 0:53,Open,Low
633f0c60-ac49-4fd4-953b-e6b80ec6581c,Angela Yang,yvonne35@example.com,001-401-986-4077x083,Customer support delay,Her technology blue six. Great accept never store.,4/15/2025 9:39,Resolved,Medium
0418f0c0-fe5f-42ef-ab90-af01265ee7b0,Tracy Huerta,allisonwoodard@example.org,+1-378-434-4905x5522,Router problem,Several he let our growth. Wind face foot task century she garden it. Respond question wear eat near.,1/1/2025 5:38,Open,High
61df4255-5e16-4d73-bb64-b46d8c6dbc0f,Renee Duke,iscott@example.org,-7904,Service downtime,Ever Democrat instead. Successful international tough article. Above year physical.,4/28/2025 11:40,Open,Critical
df2d153a-bc1d-4c44-a563-2bc45fd868d6,Michele Thompson,mary09@example.com,444.458.6548,Slow speed,Thought water art upon source measure although.,3/6/2025 21:03,In Progress,High
d987cf62-418a-4faf-b99e-11aa96d62724,Devin Skinner,travis68@example.com,001-495-669-5523x08488,Billing issue,Remain during site often among someone summer. Away free star his almost so send prepare. Book level bring size someone true.,3/25/2025 13:35,Closed,Medium
6ad0d6b7-2295-483e-bf54-85b125822733,Christopher Vega,dwatts@example.net,001-283-264-5269x83177,Disconnection issue,Mother professional account less author drive pattern leave. Site until determine mention.,1/24/2025 0:39,In Progress,High
6c4e7212-49b4-44e5-b6c0-3843fb4c80cc,Seth Ferguson,moorestacey@example.net,001-598-948-6380x3229,Disconnection issue,Data citizen memory speech child wife base nearly. Alone use serve trouble man.,5/15/2025 11:08,In Progress,Medium
7d42d275-b6b0-49e3-b70c-093059d2898a,Carolyn Cuevas,glassalbert@example.org,780-396-7134,Billing issue,Successful high everyone specific. Dream eight will doctor such.,1/12/2025 22:59,Open,Critical
04b1ce71-e78f-43f8-aaac-934734e2ce10,Brian Le,colemansandra@example.net,(663)207-5945x0629,Service downtime,Leader even effort color raise company.,3/4/2025 11:20,In Progress,High
f874b460-8a83-402e-8cf4-5caa56f02b4d,Patrick Klein,malonestacy@example.org,(441)921-9868x95004,Billing issue,Senior enter rich husband tree son nor. White sister in gun must. Budget food oil face heavy include I.,4/30/2025 23:43,In Progress,Critical
1ee91930-f3e2-48f6-b530-6dd43a5a983d,Mary Dunn,awilson@example.net,-5369,Disconnection issue,Data organization push beautiful day. Else build art.,5/1/2025 18:31,Closed,Critical
b6775aa4-21f6-4d9e-ae02-be25a76a70e8,Stephen Hall,upeters@example.com,803.836.8615x939,Service downtime,Purpose standard kid including money social successful line. Candidate ball plan manager system.,4/16/2025 10:38,Open,Medium
93209cf7-d11d-4387-a37e-40a5409cd150,Felicia Turner,stoutmaria@example.com,(979)920-0893x060,Customer support delay,Reason instead control idea design view foreign above. Explain person dream feel. Officer something look summer happen.,4/7/2025 1:01,Open,Medium
8e4ab1be-76e2-4bdb-b332-de0ac5f54e92,Shane Newman,rachelallen@example.com,360.716.1201x0387,Billing issue,Help book war fund true. Young situation new study establish opportunity around already.,4/3/2025 11:22,In Progress,Critical
b00960c3-21b8-4c8c-b503-f186c14648e9,Carrie Conner,kimberlywilliams@example.net,859-321-8684x5854,Service downtime,Rise experience enter theory church. Grow only matter half draw rise.,3/12/2025 11:41,Open,Critical
22eefd42-093c-4774-8455-65a905996983,Michael Deleon,murphyjeremy@example.org,001-741-233-2476x966,Disconnection issue,None bar nature today road. Soon form six family. Rock focus decade.,1/30/2025 20:38,Open,Medium
0b365dc3-a381-4129-857c-25ae776fcb1c,Deborah Newman,bradleyrichards@example.org,001-527-503-6967x5013,Connection drops,Plant imagine order newspaper sure else site. Dinner learn raise. Actually operation argue idea society performance song set.,2/27/2025 6:14,Resolved,Medium
b5385615-e5c7-4b93-b9f2-94cf6a7d3fef,William Martinez,alicebrewer@example.net,416.488.1618x251,Billing issue,Everybody control half pattern himself. Personal process include dark plan. Name we sure tonight.,2/12/2025 0:56,Closed,High
979ce59a-1566-4f2e-bb1a-d001acb9e962,Laura Foster,jacobguerrero@example.net,(659)563-6677,Disconnection issue,Beat never town write enjoy stage by.,6/13/2025 8:02,Resolved,Low
a83f9b72-1c6c-46b8-9734-cbfc33fa7574,Kimberly Flores,rachelschultz@example.org,+1-234-559-1054x970,Connection drops,Hit free affect than source serious recent. Score political religious least image. Official environment suggest international. Trial either player sign own mission size weight.,4/12/2025 3:08,Resolved,Critical
1aa60f4a-8a2b-4046-831d-2511d71fa1a2,Andrew Martin,patrickmills@example.org,362-740-7290,Installation pending,Other standard himself toward fight shoulder.,6/1/2025 15:23,In Progress,Critical
0bb59c66-468f-4b77-987b-5f8a14532031,Casey Golden,ylewis@example.net,-10653,Disconnection issue,Drug want ever. Huge list training field each year my audience. Moment hour environment note require.,1/31/2025 11:55,In Progress,Low
1def6101-4188-4227-9189-72d47057cda1,Diana Hamilton,isantana@example.com,+1-968-646-8970x5270,Router problem,Where guess war with site any. Beyond lead treatment speak contain.,3/8/2025 12:18,Closed,Critical
4b32e926-3de9-4ba1-9595-25dea86067c5,Kelly Frost,paulrobinson@example.org,001-855-970-2529x4966,Customer support delay,Science rock catch hope talk. Radio part shoulder clearly PM.,4/30/2025 8:25,Closed,High
d22ffaee-cbaf-4084-8a60-a46d3498d960,James Wilson,johnsongrace@example.org,001-310-692-2051x1252,Slow speed,Response get here always might price. Other page police happen best.,4/4/2025 14:47,Resolved,Medium
dbabccf9-61db-4358-a7c5-ece48cc82cca,Karen Keller,ufletcher@example.net,+1-432-297-1775x080,Slow speed,Lawyer sea world marriage per set. Matter listen type stage happen. None set improve agent. Address against put attack production service arm.,3/6/2025 1:23,Resolved,High
1fe30fe0-eda0-4056-bb10-3f0db2823e89,Danielle Perry,aaronsimpson@example.net,001-714-266-1698x772,Connection drops,Bag attention because number join throughout her. Walk enjoy the political exist large. Step situation prepare foreign group watch. Your stuff southern talk place run magazine.,4/4/2025 21:56,In Progress,Critical
794fb209-bf18-4b60-9308-ee5cdb6a1d6f,Jennifer Garcia,ubecker@example.com,693.354.5976x76528,Wrong charges,Bad sense between a. Page decade lose north low bad artist dog. Yet where size strategy exactly where fall.,5/23/2025 15:53,Open,Medium
5da193a5-51a4-49e5-97e0-3c579044d87f,Ashley Jordan,marygordon@example.org,419.345.5248x71809,Service downtime,Close vote religious particular good serve blood hope. Test reduce bed now play.,5/18/2025 10:46,Open,Critical
87e49a8d-a7d6-49ee-9993-d4e15ee11fb3,Misty Silva,alex44@example.org,641-221-1567x309,Wrong charges,Dog federal be be matter common.,1/2/2025 4:11,Open,Low
337bccd2-60e6-41e3-967b-2b812f94cef1,Cynthia Daugherty,jade91@example.org,378-588-6579x460,Internet not working,Mr choose such air better send. Family benefit ever wait director other election.,1/25/2025 21:35,Open,Low
13e15b0d-082a-4b67-897a-b61ad060826c,Kelly Shaw,emoore@example.org,8728429609,Service downtime,Win city might brother issue. Sit garden concern sometimes south name. Point other hotel minute she environment.,1/20/2025 10:48,Open,Medium
2795ce4a-a02e-4533-ad7d-8f6100c531e0,Cindy Mays,mooneylindsey@example.com,+1-654-466-2041x049,Service downtime,Also scene month cause get miss. Study more again kid author north believe. Than reveal throughout girl whole election keep.,5/6/2025 3:02,Closed,Low
c598212a-5c49-4d2a-b3f9-f1806761cd45,Michael Scott,mcfarlandmelissa@example.com,(445)883-3232x095,Service downtime,Story step relationship must production watch.,3/28/2025 22:40,Closed,Low
6b2249fa-66c4-45b6-bf6d-f772b362741c,Julie Chavez,justinwright@example.net,001-278-795-6552x62782,Connection drops,Generation inside minute benefit nature father. Back according score. Movement brother indeed. Early much camera science.,5/27/2025 19:34,Closed,Medium
96a37e66-f353-478d-b87d-90cd59483717,Elijah Perez,jordanshawn@example.net,001-978-705-9344x329,Customer support delay,Remember late cold court. Song image camera car six understand month. Condition past mother modern other same for.,4/14/2025 1:17,Closed,Medium
97c52b74-0708-4d4c-9e62-d5d415c81503,Misty Kelly,jennifer92@example.org,413-744-4784x297,Connection drops,Shoulder three view physical follow. Pick phone might service amount. Cold throughout join interesting tax discuss.,5/27/2025 1:58,Closed,Medium
5f49241c-fad2-4789-814b-f78c4f88c300,Alexander Walker,pharris@example.net,(460)484-0139x8913,Internet not working,Mission ability guess role drop.,1/17/2025 15:19,In Progress,Medium
bd67e141-0902-48be-8bda-49b77101076c,Gregory Warner,hrodriguez@example.org,(971)952-2071,Disconnection issue,Analysis religious candidate artist return. Set decade individual. Man miss reflect team. Pattern TV weight close will choice next concern.,3/13/2025 9:21,Resolved,High
1c0b5feb-f51f-4c86-ba11-03c5084e4b63,Virginia Harris,ihenry@example.net,704-531-0102x28707,Disconnection issue,Protect born hospital relationship ahead not describe. Various hour realize main though region.,2/28/2025 9:36,Resolved,Critical
44dab906-85c8-451d-8900-4ec85eb53e52,Jennifer Mason DVM,nancy10@example.net,223-838-3688x6363,Billing issue,Traditional school bring artist strategy partner. Two organization order bag blue policy.,4/22/2025 5:32,Closed,High
e707102c-907c-4d76-8e29-6ab99d8e7ec9,Mrs. Barbara Bell,bradleymichael@example.org,6715590896,Internet not working,Sing learn certain new continue person back away. Rich financial they loss. Instead make individual follow response quite.,4/18/2025 15:19,Resolved,Medium
f51f2778-bf75-4567-abf6-a064a5934fb9,Brian Ramos,silvanancy@example.org,(510)369-1384x76873,Disconnection issue,Husband two state other economic everybody west. Himself son face image its head information. Democratic food list international leg debate.,5/4/2025 1:30,Resolved,Critical
8dc5a338-56a0-4ca5-83fa-0d81f5d0b50a,Steven Bell,ltyler@example.net,823-489-4666,Connection drops,Among think finally whatever often term. Task common build inside firm but against. Personal pay knowledge fact box per know interest. Most activity open maybe pass later tonight help.,2/7/2025 10:11,Open,Medium
e137d1fb-73da-4c55-8a03-7316db36247b,Kevin Phillips,fcontreras@example.com,(570)365-3267x90397,Disconnection issue,He effort better Congress. Model foreign test left. Brother talk community. Yeah either kitchen north.,1/27/2025 19:17,Resolved,Critical
9f7eaead-0ae3-4623-b8a8-6f46faaf0c76,Antonio Hood,kennethbutler@example.net,383-914-9148x02097,Wrong charges,Bank hear door everybody window. Recognize half third we avoid ability attorney. Lay middle us game.,3/10/2025 16:10,Open,High
520090c2-b6d6-4d45-8595-1bb44131fd9b,Jose Potts,milleramber@example.com,+1-567-892-8575x87022,Installation pending,Pressure visit range. Explain material stop put all. Most task evidence.,5/28/2025 2:31,In Progress,Critical
3444afd4-072c-442a-82f0-aa2f84b39212,Stephanie Martinez,gilbertandrew@example.org,(206)546-4729x697,Service downtime,Exactly trade forget next. No commercial little campaign book must.,5/20/2025 16:25,Open,Critical
e27e23b9-77ee-4426-a651-1092b4ceeac2,Michael Bell,nicole09@example.org,+1-212-820-4762x8318,Internet not working,Western cold travel. Itself amount security north song decide born focus.,2/27/2025 9:30,In Progress,High
d3a5f401-ce2c-4d30-a7b2-00c61f2a0765,Clifford Rodriguez,jenningsrobert@example.net,845.288.0409x7898,Internet not working,Factor almost agreement open. Form security mother meet against free change. They that degree meet eye.,3/17/2025 1:41,In Progress,High
404bf139-74cf-4353-90e3-ab2d112b30e2,Ashley Holmes,jeffrey63@example.net,356-209-6970,Router problem,Wind admit garden never car whatever. General send kind.,6/10/2025 23:59,Open,High
eac14a67-6deb-4a08-b2f8-8202ce620e4f,Christopher James,yhicks@example.com,001-242-948-3377,Billing issue,Inside team little speak although bad. Study parent form book long. Close various tell why bit. Area carry yourself PM artist good case.,6/18/2025 3:57,Open,Medium
5ce81e1e-cbaf-4544-b324-42eab02fa9fb,Douglas Donaldson,nhernandez@example.net,247-347-2467x4646,Wrong charges,Majority mean much company. Game key decide after politics.,1/2/2025 5:07,In Progress,Low
49440afa-32b1-441c-8079-c782e73d3400,Timothy Miller,washingtonroger@example.net,+1-758-207-0525x391,Router problem,Across organization message beat. Fire management point answer.,2/27/2025 16:27,Closed,Critical
44f10009-fb9f-48bc-a4ec-a5c14f9dbd93,Carlos Mann Jr.,brianroth@example.com,+1-980-662-4469x689,Billing issue,President dinner appear herself response everybody. Not power gas ground check east beat.,2/23/2025 18:47,Resolved,Medium
ec367bab-be8c-4dcb-ae18-36847e91bff7,Ryan Collins,omoon@example.org,263-449-1085x5792,Billing issue,Cost easy begin grow rather. Watch industry else back senior miss. Year here science save sister organization. Talk gun difficult thus.,4/4/2025 22:13,Resolved,High
0693be97-22b8-4fcf-bb27-f89aba66a555,Madison Mcintosh,lopezmichael@example.org,(956)590-6851x505,Service downtime,Plan low theory. Paper represent research Democrat. Pay speech career ask grow spring dark. Total moment exactly minute himself.,3/25/2025 16:58,Closed,Critical
ad280d2f-514e-4c8b-8877-01c09db7d29a,Patricia Bell,bwalters@example.org,001-881-834-1396x4586,Slow speed,Idea seven memory exactly center experience.,6/4/2025 10:44,Resolved,Low
8226cb79-9942-4e49-b598-104bd041aa88,Gregory Garcia,kmcmahon@example.org,358-749-3547x44435,Billing issue,Next deep technology thousand. On though whether action example chair executive. Miss heavy character class else traditional cup somebody.,6/15/2025 8:09,In Progress,High
02bcd197-8082-4f98-9dfb-74a19323eccf,Terry Lang,annettecruz@example.org,+1-400-750-2996x52784,Installation pending,Sea modern reveal sell. Place care college down born begin like. Draw kind why those word determine section.,3/8/2025 4:16,In Progress,Low
0ad06cce-5606-4139-a4c5-bd280a53b7ed,Teresa Chan DVM,coxsteven@example.org,001-321-419-9239x00756,Connection drops,Ever century speak arm late kitchen go. Gun southern center what wind too movement.,4/21/2025 4:38,Closed,High
c769d18c-31d9-4926-b46d-5cc3b054b8cf,Julie Grimes,mstone@example.net,2883092080,Internet not working,Stage agreement through return class argue everyone. Beat art hit different cut. Night hair political smile.,4/20/2025 18:35,In Progress,Medium
53aa789e-8898-41cf-8863-1f0cb1b5f03c,Sean Carter,nharper@example.com,001-608-336-9248x225,Internet not working,Large science follow free prove.,3/6/2025 19:02,In Progress,High
d1555b2d-e264-40ec-aa13-4ff77a25621a,Sarah Gonzalez,cmoran@example.org,(545)293-0111,Customer support delay,Area government seek position again. Assume show national leave growth listen happy. Major describe owner.,6/5/2025 20:35,Closed,Low
543e24fc-e3c2-4266-b7e6-42b34cd092d1,Kathy Sharp,carrheather@example.net,+1-850-917-0009x810,Slow speed,Lead area gas meet military week. Find cup president eat between fire.,5/6/2025 1:32,In Progress,High
790bab3a-de16-4639-8934-7a81202295f5,Christopher Fuller,cole42@example.com,448.469.2934x28032,Router problem,Listen town memory the growth staff tonight. Level top herself social thought. Least opportunity usually dark really population.,5/20/2025 10:34,Open,Critical
e0aab370-ecee-4447-83b0-45b267981c39,Matthew Allen,wtaylor@example.net,+1-891-845-6244x46673,Internet not working,World number effect travel good nation. Every your ground test. Call most they authority operation. Than father behind trouble goal ok ready.,6/9/2025 9:23,Open,Critical
940475cf-2f41-48c1-bd81-05455c57b053,Michelle Nelson,joshua64@example.com,658.678.8728x7571,Service downtime,Morning meeting person leg few but. Help yourself present open.,2/16/2025 1:30,Open,Medium
bd8adab2-0dac-48f5-8f5a-fbe04f6baf8c,Shirley Smith,tdavis@example.com,-10782,Wrong charges,Walk lot since section determine way sure. Home attack many treat good fall. Science enter important big good already brother but.,4/25/2025 13:31,Open,Medium
8b09f096-dd6f-4525-8971-0820a344c80e,Kelly Lewis,hillderrick@example.com,852-923-7137,Installation pending,Might treat or. Matter until machine.,5/25/2025 2:22,Open,High
d044c900-c78e-4c7c-b5ed-8ee631b5fa4c,Gina Campos,rossalexis@example.com,001-237-792-3847,Billing issue,Support go need after activity tough. Radio response next bill sister let.,5/15/2025 7:37,In Progress,Low
e9ff8839-bccb-4ca5-8631-00b7d32e40a1,Dale Ramirez,brownamy@example.net,(218)457-4300x995,Billing issue,Five will deal result final himself. How fire artist former different federal simply. Will be third rich. Civil job both which.,3/8/2025 13:38,Resolved,Low
b510d538-dc96-4c67-b0f7-e3a43fe7303c,Connie Haynes,charles85@example.com,776.948.5262,Connection drops,Off service real music partner of six bed.,1/31/2025 22:03,Closed,Low
c48279f2-25cc-40dc-aa53-4b634906a7dd,Kristen Hudson,wendyskinner@example.com,905.458.0000,Internet not working,Would article significant. Wish head right what project. Throughout wind color see.,2/18/2025 11:06,Open,Critical
00aafb74-abfb-4aa7-b490-02deb61ab99b,Andrea Franklin,twade@example.com,7628628615,Connection drops,Blue third until pick option name statement necessary. Though indicate rate then air save. Cup show large score own scene health note.,6/19/2025 17:25,Closed,Low
4d53b278-0d20-4568-b371-238ab4edd8f3,Taylor Olson,matthew56@example.org,(856)383-5530x600,Customer support delay,Control play house turn bed for.,4/4/2025 14:34,Open,High
ac9080e6-0386-4f2a-8bcb-880cc1e783c4,Hailey Mcdowell,edean@example.com,915.441.7667,Connection drops,Note value design soldier. Share four specific near letter image bank.,6/19/2025 21:13,Closed,Low
9f05a8f5-9d49-4f4c-9141-85ccccd9abdf,Kevin Torres,andreajones@example.net,6555733076,Disconnection issue,Soldier meeting wife. Certainly miss how determine itself same.,3/4/2025 17:36,Closed,Medium
15542be5-bda8-489e-8b03-f9e70abf5ec1,Bonnie Ramsey,gordonglenn@example.com,500-906-0096,Internet not working,Act time need. Better life chair minute majority work. Grow civil help show.,1/25/2025 23:52,Open,Medium
555d478d-e776-46c0-a9a1-a60b6d5d902d,Shannon Joseph,susanbell@example.com,+1-341-288-4453x8835,Billing issue,Ago yet discuss citizen. Community class artist determine try attorney serious. Buy town factor herself only book because whose.,2/7/2025 20:32,Closed,Critical
835d7206-6455-47a2-94e7-815514bd0d89,James Reid,kelseydrake@example.org,280-297-9171,Disconnection issue,Moment federal role hear impact gun with. Board tend audience.,6/2/2025 4:50,Closed,High
f84e1724-27f9-4619-97d6-dd2f8fd1cb93,Craig Colon,laurenlittle@example.org,5274674511,Installation pending,Development word meeting message side worry. Tree able appear particularly exactly.,4/2/2025 7:04,In Progress,Low
5634a738-72fd-4250-8c10-e43f8fdfa98c,Megan Lewis,whernandez@example.com,001-436-423-1835,Router problem,What out sit sign. Notice station itself green crime my if. Indeed shoulder sit door stand old. Before degree professor federal.,3/31/2025 7:36,Closed,Critical
67df1ef9-aa8d-4c8a-b029-3ad650043514,Sarah Hamilton,watsonjeremy@example.org,+1-366-622-3634x01607,Disconnection issue,Research next reveal oil major color. Rich trial thank. Drop account today former week least project.,6/23/2025 0:58,Closed,Medium
9c1ae5b4-a9d3-4557-a2eb-df2eb38609ce,Mark Brooks,brandoncarter@example.net,001-265-469-7851x7852,Billing issue,Store time involve after area. Key job word top soldier lose skill.,6/17/2025 4:44,In Progress,Critical
49cf43e8-c13f-4ba4-be9d-27e974af9287,Troy Delgado,jennifer71@example.com,2673655286,Installation pending,Us per fast feel pretty final until budget. Describe thank artist far.,4/3/2025 3:34,Closed,Low
30378c7e-6336-4e65-b9ad-9b29dff72d91,Randall Armstrong,stephen79@example.org,+1-706-415-7268x441,Installation pending,Though sit operation rich. Clear remember hot sister can store.,1/24/2025 5:20,Open,Critical
197564f9-ffba-4be8-b523-1d53f2e1c20c,Carla Parker,lgibbs@example.net,400.202.8532x5169,Router problem,Choose measure far address organization nor win. Two off short child too expect dog finally.,6/12/2025 21:06,Open,High
