customer_id,customer_name,email,phone,complaint_type,complaint_text,created_at,status,priority
63cb5aad-705a-4e76-93db-a8034b3ff9fc,Nichole Scott,gmarks@example.org,974.407.4198x1610,Connection drops,Official admit standard maintain. Four three response American need must strong.,4/5/2025 13:19,Resolved,High
cbe6732b-bd2b-4695-bb3c-ddc94fd76a9b,Jeffrey Armstrong,robertwilliams@example.net,001-501-628-3785,Billing issue,Lead east growth lay several bar us. Himself admit better idea onto.,6/20/2025 11:11,Open,High
9ed4af8d-8e3c-43ff-99d4-efdc7543a399,Julie Dickerson,jimmy03@example.net,875-868-8191x6454,Disconnection issue,Interview simply food hold garden recognize bar. Ball dark newspaper machine front. Standard already positive reveal positive dream.,1/11/2025 7:00,In Progress,Low
eb7b393c-5bae-4e1e-8465-e8d2e8434df1,Danielle Powers,philipramirez@example.net,(580)458-1243,Customer support delay,Bank guy run. Outside similar bar table charge against.,5/11/2025 14:47,Open,High
5837572a-ccf5-416b-86ee-3298abdbd374,Christine Duran,lisaevans@example.org,+1-588-972-9147x9438,Service downtime,Contain this red drive. Different defense able explain skin nothing do. Either become much face outside onto.,1/27/2025 13:34,Closed,Low
0837ccb2-0e87-492a-876d-750687089ebf,Patricia Nelson,wrighttimothy@example.org,464.469.8612x891,Connection drops,Beat word gun. Enough really attack main.,1/24/2025 14:49,Resolved,Low
3f0dc59b-4f2f-41f9-85af-f429b8d5abe2,Natalie Vasquez,amy47@example.org,382.769.1074x6409,Internet not working,Suggest road national outside. Him control young strong tree.,2/23/2025 3:30,Open,High
27d8369e-26b4-474d-b026-2394ac9f9e76,Jessica Martinez,sbradford@example.org,529-240-7793x374,Service downtime,Truth sport painting alone. Enough everything interest.,6/16/2025 21:06,Resolved,Critical
3dc6a5da-bd29-4cde-9e49-03959bbc7d07,Daniel Grant,icummings@example.org,555-826-2318,Wrong charges,Clearly special south hit. Eight need rise scientist away community.,2/19/2025 2:03,In Progress,High
dc43c739-7fc9-465e-9644-8cb6c33f5fd0,John Adkins,herreraeduardo@example.org,397-401-5702x654,Wrong charges,Face product treat perhaps many. Wait toward claim spring agree. Morning picture teach usually suddenly according.,1/6/2025 1:15,In Progress,Critical
08bc4cde-04e0-49c0-9ad5-ee0ede6db652,Norma Perry,zoedaniel@example.com,-7291,Connection drops,Wrong enter line year. Produce south decade theory adult sit. Lead happy language lay among stock right.,5/15/2025 7:58,Open,High
74716a59-34be-4ac2-be9e-597df37a4b3f,Natalie Thompson,uruiz@example.org,001-981-300-2212x79444,Service downtime,Send head money reflect on. Human debate but effort actually.,3/30/2025 20:10,Resolved,High
fec03aac-4322-4ef7-9a68-8d7fd1f8a2e3,John Garcia,juan09@example.com,001-503-362-8432,Disconnection issue,Life different down movement identify talk election. Prove notice whose year carry. Or president life.,6/1/2025 23:09,In Progress,Medium
500a9ec4-58ba-4525-8468-59fa0e4fef09,William Watkins,wgarcia@example.com,(262)210-9848x00019,Disconnection issue,Idea case sit full build suggest win. Course fish government whole.,1/29/2025 21:29,In Progress,Medium
52aa5b25-ae16-4970-bc9b-43ce4b38bda5,Emily Villarreal,ladams@example.net,(766)678-6128,Service downtime,Head cell floor job enjoy final. Reveal part church medical protect woman.,2/9/2025 19:34,Closed,High
2f3e989b-3d3a-4e69-b1d0-cd3f68b9ae3d,Wayne Snyder,james73@example.org,+1-885-284-2431x941,Disconnection issue,You subject trial lose. These positive simple sea performance.,4/8/2025 13:09,In Progress,Critical
e96f9a34-15a1-4f66-964c-34da072f2069,Tonya Barnes,paul16@example.org,991.909.1515,Customer support delay,Measure particular simply role amount everything. Activity score feeling.,2/10/2025 15:28,In Progress,High
33a1b687-a0e2-43ba-8962-42571e5b8c60,Christopher Santos,moorevanessa@example.com,-1481,Slow speed,Pm name grow long vote like gun. Already while should seem.,6/23/2025 7:25,Resolved,Medium
233d0417-e8c7-45f7-81fa-033d6195d9f1,David Bishop,michael35@example.org,470-772-6094x6327,Installation pending,Return alone then candidate reason. Help since social late bad money course south. Why leave even keep.,6/20/2025 4:30,Resolved,Medium
fd256d0e-9880-4429-b619-7308714f686c,Becky Campbell,marybowman@example.org,246-764-7269x03027,Installation pending,Tonight prevent service ground. Score the responsibility education gun. Century stop style president position if charge. Drive turn meeting style eight better process.,1/31/2025 17:08,Open,Critical
2a77f30e-bc65-4790-aaee-27f133f4344a,Timothy Byrd,richard33@example.net,001-214-915-8127x103,Installation pending,Deal less put bit none space. Ahead I tax seek effect Mr occur in. Act reveal imagine outside financial.,4/25/2025 2:08,Closed,Critical
159f1518-33c9-4bf1-83d2-4cb0479a1c49,Alyssa Foster MD,timothy45@example.net,(777)334-9892x866,Wrong charges,Learn less friend thus heavy carry. Last fast down trade sense whether yeah.,5/12/2025 13:57,In Progress,High
c06cf809-c92d-41b7-9e6a-f694ecf40bad,Holly Russell,joshuathompson@example.org,554.972.7634,Billing issue,East worker decade similar account cultural term. Few would degree trouble. Very state sea.,6/27/2025 15:10,Resolved,High
fcacd6f7-6875-49bd-ab9a-15946e1358eb,Todd Williams,joeladams@example.net,001-823-853-8618,Customer support delay,Pick imagine agent kid health different. Civil view none necessary.,6/11/2025 12:13,Open,Critical
8f8a0dc7-e408-4a2b-a13b-6de3a48e1a5f,Jennifer Lawson,djones@example.org,633-999-5429,Billing issue,Compare effort how. Similar experience our collection personal red long. Foot bill line health everything move adult.,5/26/2025 5:11,In Progress,Low
23754f80-e045-4023-9472-dea66d9186a5,Cassidy Garza,uaguilar@example.com,657.561.3793,Customer support delay,Avoid enjoy follow single friend join sense deal. Toward state ten reduce concern fact city. Although each keep open couple wife.,3/17/2025 23:34,In Progress,Critical
3e1c05a3-f3a7-426e-8eaa-4d8b9cb77217,Monica Delgado,jody91@example.org,582.582.1591,Disconnection issue,Common movie forward else keep eight require. Rather top industry score bring.,4/11/2025 12:01,Open,High
24c33e8d-007e-4f1f-b259-5115daeab8a1,Jenna Moore,bdavid@example.org,(318)653-8000x1349,Wrong charges,Right produce somebody cause. Else feel information protect election summer. Its few Congress start live through.,5/11/2025 7:16,In Progress,Medium
c5406cbb-27ae-4e45-b99f-41f0e42b063c,James Potter,daisy16@example.org,8655734556,Slow speed,Realize law check. Theory station then tax nature.,6/13/2025 23:23,In Progress,Medium
0f1bfd70-e5f2-4066-8c26-55be61485bfd,Melinda Carpenter,wilcoxrebecca@example.net,354-206-2991x75671,Installation pending,Southern phone occur help guy far. Then fill exist level.,6/22/2025 8:18,In Progress,Critical
09083802-4f6e-4e94-a870-4bfe29a99645,Andrea Lewis,amy51@example.net,813-314-9204x306,Connection drops,Learn where foreign information. With career husband treat course per. Cold figure again threat garden say course movement.,3/23/2025 20:53,Closed,Critical
bcccdaee-6c50-47cb-abfe-a0f7f569f9e8,Brandi Ramos,christopher12@example.org,(825)927-6200x5116,Billing issue,Question feel week.,3/31/2025 6:24,In Progress,Critical
a25d06ec-e2e6-432b-a850-5891bef796cc,Joseph Gutierrez,kathrynmaldonado@example.org,(532)236-4983x62620,Slow speed,Her hundred imagine talk. Car car series everyone course. Much carry technology forget send.,5/21/2025 4:22,Open,Medium
85d90f38-bb0e-4cfe-a483-a5f9de7be2a6,Jeffrey Joseph,matthewsmith@example.net,001-483-329-9700x94225,Billing issue,Within budget argue would important time its family. Though never off material suddenly accept. Drop can score look.,3/9/2025 11:43,Closed,High
b403133f-9d83-4e19-8f24-93de6a5ab097,Anthony Conrad,christopher68@example.org,001-727-321-7587,Disconnection issue,Design fire role per. Newspaper ground along inside growth.,2/14/2025 22:46,Resolved,Medium
e6568202-2a91-459e-8762-6a4c5e708cbf,Hannah Leach,justin72@example.com,(552)287-8453x9457,Router problem,Newspaper power dinner day.,2/24/2025 18:58,In Progress,Critical
01ebefa9-4d63-4a63-aab1-a9a335235e6a,Bradley Davis,natalie05@example.com,001-894-529-3669,Customer support delay,National program along man beat pay instead. Color history billion gun pay. Eight performance cut better control war.,1/20/2025 7:02,Open,Critical
0bcfb0f4-185a-41c2-9300-cfd19a0d54ec,Joseph Estrada,currytammy@example.org,6804118761,Disconnection issue,Surface as agreement ask than wall. Better gun attention address happen run. Smile quite reach there bring commercial heart.,1/12/2025 17:05,Closed,Critical
ff482f0d-8d5d-41cc-8a1f-f03b37ac6170,Jennifer Anderson,jason90@example.com,577-238-5729x39530,Slow speed,Investment rock newspaper face understand. Person child every control benefit other. Movie expect there by media rather.,6/9/2025 16:14,Open,Medium
624396f7-3235-4735-b671-4fad356dd7b3,Amy Reynolds,cboyer@example.org,435-560-9228x373,Slow speed,Alone doctor know describe real recently might fact. Size accept impact together why meeting officer.,5/14/2025 19:13,Closed,Medium
ea7732bf-de28-4b07-946b-7351c7b3affd,Jennifer Simon,christopher57@example.org,617-270-2458x437,Connection drops,Prepare finish drop short door. Recently professor state rise director on bring.,6/22/2025 22:22,Open,Low
1d3951aa-558e-47c1-a3c6-1b8337b3b71d,Robert Lee,chris86@example.com,768.590.0281,Service downtime,Conference much these letter week act. Light information focus partner thought debate left. College note pressure able knowledge feel protect.,1/23/2025 15:10,Closed,Low
eba5e89f-8dc8-4b58-9897-17aa4c01c09a,Edwin Clark,irobertson@example.net,774-856-7708x794,Service downtime,Risk statement through house push others friend director. Natural guess check past mind.,1/5/2025 7:32,In Progress,Critical
c692042a-252f-482f-a414-b32c6a184617,Danielle Neal,valerieburnett@example.com,582-921-8056x224,Service downtime,Hope cover election everybody. Less recognize section develop man item radio. Huge pay phone nature star position.,3/16/2025 22:53,Open,High
0730c214-eb47-417d-9c0d-3e3c9bb7b90a,Kristen Patterson,nataliemiller@example.org,9277583421,Wrong charges,Detail road blood practice doctor down. Time more government share man young. Watch speech trouble front others ten event.,1/18/2025 12:50,Closed,Critical
bc56b69b-0540-43f6-baaa-ea055a2e4358,Robert Watson,dominguezsteven@example.net,001-408-410-3552x01983,Billing issue,Skill picture already firm special. Meet tax century give value.,1/18/2025 13:56,Closed,Low
08687679-248a-4655-8d44-765d72682314,Sarah Gibson,bdeleon@example.org,(636)701-1223x70370,Service downtime,Girl between rule international yet key. Appear fast member. People moment development him politics citizen ahead.,1/24/2025 18:23,Open,Low
c4101695-6599-4321-ac79-bee1f89843c6,Stephen Cobb,pbrown@example.com,001-261-587-8015x61436,Disconnection issue,Whose focus full. Skill case stand. Rock trial attorney push tough staff.,3/26/2025 8:33,Resolved,High
31d98021-b193-47a0-ac06-93d115db651f,Tyler Cooper,tommyvelasquez@example.com,3458226445,Slow speed,Professor carry free control. Executive tree again realize player difficult tax. Well wish increase join.,3/27/2025 20:43,Closed,Medium
31f766e9-6c66-426e-9b95-4a3d0751a758,Larry Patterson,avilakimberly@example.net,242.857.8612x57082,Internet not working,Among father him technology type federal. Around visit drive conference even. Mr boy push result.,5/19/2025 1:40,In Progress,Medium
a3e9c692-4e15-40d5-a037-a4234ead340b,Kevin Murphy,gonzalesbrett@example.net,(207)593-2320x791,Installation pending,Adult away something buy performance spring. Various guy two challenge fast himself. Relationship color maintain.,5/30/2025 8:23,Closed,High
ddb02c9c-9557-47df-8636-2f1af683a173,Bradley Fisher,keith68@example.com,+1-951-828-3261x907,Customer support delay,Across draw member. Entire memory out day. Thousand yet resource continue cost.,2/14/2025 1:56,In Progress,High
c8305a1d-7b8a-4189-8ebd-ebd3ce2e7904,Sean French,adriancarrillo@example.com,(391)873-9762x606,Customer support delay,Before throw on news.,3/7/2025 3:04,Closed,Low
63e4c8b4-3cd4-4182-8434-067a68df1148,Emily Smith,larsenjason@example.org,(521)290-9327x8211,Wrong charges,Evening coach store require. Face along course end. Man provide although.,3/25/2025 12:13,Resolved,High
a49b72de-bbf1-4aaa-81fb-8aa11dc04404,Michael Jenkins,yvonneday@example.net,+1-334-885-0333x41454,Disconnection issue,Section at professional notice. Author whether because real simply. True see different campaign specific bar. Run find church movement.,2/21/2025 4:14,Open,Low
7beaf9ac-7a6b-45a5-b4b3-c520054b475f,Jose Lee,joseph09@example.org,(951)842-8893x4448,Router problem,Mother cause effort fall onto Mr own. Wait stay everyone indeed stop involve. Situation spend between others wife.,1/9/2025 23:08,Open,High
770ae92e-5299-45ef-bd69-4e579823a3b6,Edward Miller,alexanderramos@example.com,(913)315-1960,Billing issue,Raise increase everybody south central himself. Beautiful design myself management. Kind buy first financial fall rest.,3/9/2025 3:03,In Progress,Critical
d7b65f9b-846d-41a4-8518-e1f393c5229c,Shane Reese,susan90@example.org,+1-243-394-8800x90519,Service downtime,Share front action player meeting and. Direction will whom make.,3/24/2025 14:06,Open,Medium
9df6cebf-939e-4e45-bae1-916196a39d2e,Amber Lopez,johnsonheather@example.com,860-776-9893,Router problem,Fill money personal energy understand.,1/11/2025 4:32,In Progress,Low
f6115671-574d-4b3f-835a-1d9f1b5f9157,Tyler Campbell,qarnold@example.org,001-443-373-5074x57523,Wrong charges,Southern Democrat especially a amount. Life research include certain blood step and them. Watch spring base election find.,4/2/2025 8:50,Closed,High
03f4b60a-2e27-424d-ad28-0fec837aa4d6,David Hamilton,zturner@example.org,+1-929-623-7855x008,Wrong charges,Officer crime thousand apply might good machine. Development trial cultural responsibility responsibility deal. System decide per high concern much mission.,1/20/2025 21:29,In Progress,Critical
e6ad361e-0294-4a6e-ad7d-f822f0d0f8ae,Carolyn Beck,cfoster@example.com,889.618.5839,Customer support delay,Avoid term scene somebody detail among simply. Sometimes middle former alone. Live talk reason.,4/7/2025 2:31,In Progress,Critical
3c393fca-f750-4b8a-a70b-7d04c7bee51d,Elaine Richards,james49@example.net,494.346.4738x50967,Internet not working,Evening miss role outside maintain company activity spring. Many eye country trade gun but very stuff. Administration oil push race end believe like.,4/5/2025 2:09,In Progress,Critical
0a111a46-24f6-4aa1-98d2-bb723e275ae6,Michael Smith,kathryn57@example.com,+1-279-804-0124x2447,Router problem,Raise or subject particular. Performance hour same walk table how. Several state choose course if so result.,1/9/2025 19:10,Open,Medium
669de7de-ae68-4ae3-a44e-ea7d50add5ac,Bonnie Evans,linda05@example.net,+1-444-358-7497x87272,Service downtime,Above start beyond defense suddenly right. Must would protect point pay. Others boy school relationship meeting bar movement.,4/20/2025 7:02,Closed,Critical
abdb6390-8318-4298-8cfe-1085ab83ebd0,Eric Miller,josephhuynh@example.org,-3086,Wrong charges,Leave almost home.,5/1/2025 7:18,Resolved,High
9d46ff23-2576-4b2b-b9f0-a9d9efcca204,Joshua White Jr.,hbrown@example.org,001-242-319-2543x156,Wrong charges,Bar stop tough everything. Crime draw woman necessary onto.,1/27/2025 18:12,In Progress,Medium
9d82c871-30ef-4b36-a750-f2f2486a2125,Belinda Stanley,madisonpeterson@example.com,299.956.2802x5777,Router problem,Society main recognize significant hundred Democrat. Help free east.,6/18/2025 13:47,Closed,Low
37561734-75e6-45c7-9e36-90cb41b6e054,Shannon Weaver,danielwheeler@example.org,-3657,Connection drops,Guess what pick maintain skin. Might series class guy see establish professor. Increase each future similar.,1/19/2025 12:58,Resolved,Critical
40b7d675-6c2e-4c45-9bd0-7adbd901a26d,Anthony Key,pricejoshua@example.org,3209081905,Internet not working,Determine laugh send seat reach avoid election between. Hundred be buy chance matter wait. Compare argue stock stuff can thought rock.,2/24/2025 20:01,Resolved,Medium
ca4e1388-0cee-4ffd-b2ff-e5440fa69296,Mario Johnston,alejandrothompson@example.com,808.341.8634x696,Wrong charges,Entire major rule project. Enough bar town face.,2/18/2025 12:17,Closed,Low
025da46f-df9a-4d8d-86ea-92f4c3cd5fd4,Jamie Morales,ssimmons@example.org,896.755.9998x488,Customer support delay,Religious worker both western view of among. History wear appear glass himself partner. Also evidence allow knowledge own. Among agreement collection Mr campaign late television.,3/16/2025 20:28,In Progress,Critical
47042301-6489-4955-a01d-678557363e4a,Crystal Griffith,ricky41@example.org,253-490-1251,Disconnection issue,Page respond already approach dream. Customer pattern her raise attorney improve matter. Mouth peace field toward score course.,3/25/2025 8:53,Closed,Critical
6f6ac303-97cb-4b8a-8ac6-c20e274439ba,Sherri Carter,sheltonstephen@example.net,259.952.8379,Customer support delay,Star season bad require question pressure. Suggest travel west might.,2/15/2025 11:53,Open,Low
2b53052f-0cfa-4603-81ab-51de3a3f493d,Frank Jones,rollinssydney@example.com,-2198,Internet not working,Interest view four recognize what far then. Popular though pay other how.,2/15/2025 22:37,In Progress,Low
077e3fa5-f441-40c8-9a03-88b2b4f4c259,Brittany Garner,kphillips@example.com,5933062784,Router problem,Opportunity statement feeling to environment game best. Station total create necessary. Economic goal drive enjoy mission.,6/7/2025 1:02,Open,Medium
f881e489-3657-4c69-831f-57031cf9bde7,Megan Brewer,uadams@example.com,359.913.2286x532,Router problem,In talk rock three may dog. Month call away provide adult mother trip.,2/1/2025 4:59,Closed,High
7b62b2da-afc8-44f7-b1e7-193eee3c690e,Gina Martinez,susanharris@example.org,(697)411-5587x92020,Service downtime,Campaign knowledge site tend election live. Century third itself yes apply standard owner.,5/19/2025 3:15,Resolved,Low
e9e0ef42-4a24-4b3e-aa69-9bee333a62fc,Amanda Edwards,ystewart@example.com,899.434.0933x34262,Wrong charges,Second cover high front remain should marriage. Recently mention glass single movie. Really trade material care blue.,5/21/2025 15:43,Closed,Medium
b714686f-6b87-4351-bedd-cabd8c61900d,Douglas Allen,lindacervantes@example.com,468-414-3576,Customer support delay,Education whatever million majority. Popular floor staff food quality notice. Standard voice war live city popular argue.,5/19/2025 4:00,In Progress,Critical
4220f54b-78d5-42b5-b311-361ef3e23c68,Ann Cruz,hhall@example.net,(426)384-5493,Installation pending,His have hear certainly wife. This appear practice ready. Note new beautiful.,3/9/2025 6:55,In Progress,High
b4dc6e0e-3605-45b1-87da-6184906117d5,Robert Smith,johnferguson@example.org,466.630.2711,Disconnection issue,Probably house thousand. Let ask speech between the.,4/5/2025 8:35,In Progress,Medium
feffea1f-f2c7-442d-8d3f-5514a275d745,Erin Copeland,becky35@example.org,492.748.5150x74515,Disconnection issue,System feel investment impact page. Doctor wear goal federal half.,6/20/2025 18:30,Closed,Low
d04c59c6-f92d-4deb-9d08-f2dd22958511,Cynthia Robinson,lpeterson@example.org,001-949-258-8906x6958,Installation pending,Plant red show low network. Half lose however begin.,6/22/2025 18:41,Open,Critical
61b99ee0-26e8-4fb5-9fff-20a128ab1ee2,Christina Warner,kbaxter@example.net,8616547074,Internet not working,Practice responsibility account window could own. Occur phone kitchen morning green.,4/23/2025 5:19,Closed,Critical
9839e8b7-e779-4ccf-ae1e-97b464c21341,Melissa Tran,steven02@example.com,001-501-398-1254x718,Service downtime,Nature issue remember us prepare image answer. Girl worry painting officer. Truth commercial never five seven sort usually.,3/19/2025 0:41,Open,Medium
36be4efc-e9ae-4d01-bc63-7a2e78751bb5,Jonathan Stevens,judy99@example.org,702-685-7283x82761,Billing issue,Policy anything former tree discussion. Exactly side strategy Republican officer television. Left billion give behavior big buy.,6/5/2025 10:19,Closed,High
052b7a60-91d0-4851-88fd-8e431d8ddaa9,Ryan Forbes,johnsonjeremy@example.net,475.907.5213,Internet not working,Like from lot moment true. Early professional around. Some newspaper state serious indeed west inside.,3/21/2025 9:24,Closed,Critical
b9e724aa-5a17-4c2b-9872-f4c7fa446349,Ashley Lopez,kirk40@example.net,977-957-0133,Customer support delay,Tax training law design operation catch note. There box partner free measure artist. Open point step plan game usually experience.,1/25/2025 21:07,Open,Low
07dab54a-7a3c-49b9-a7fa-c2e9533a0caf,Heather Pierce,braynatalie@example.org,(426)831-6843x907,Connection drops,Up model rule. Whole rise could better could man.,5/28/2025 19:29,Open,High
be748bcb-c4a2-4def-be60-dca71d8a6c7f,Mandy Skinner,benjaminbrandon@example.net,-988,Customer support delay,What serve exactly back let follow. Because decide think mean memory environmental particular. Simply near piece sing operation painting.,6/5/2025 7:48,Closed,High
c8a8ed69-b557-4e08-a932-2e6d4ca9caca,Jason Jones,bgilbert@example.com,001-815-493-0385x743,Connection drops,Scientist since heart feel bit produce.,5/31/2025 9:03,Resolved,High
9b0cc5b8-d2b6-46f2-905d-406ef3c5474a,Gwendolyn Jacobs,andersonwilliam@example.org,2944608499,Customer support delay,Me gun enough son bed deal military. Himself my later science happy base service agree.,1/28/2025 3:40,Open,Critical
83f24fbc-5df9-481c-b64e-8d48ee9cc62d,Rebecca Hill,johnsonjames@example.com,400-417-8192x01790,Disconnection issue,Important so management better. Probably social field. Air it above. Artist prove usually production serious system woman.,5/4/2025 8:00,Resolved,High
ef0fe4b1-1798-4ef2-a712-24940d911217,Natalie Ellis,jessicareynolds@example.net,323-563-7157x4238,Router problem,Might sing six thus. Stage then administration recently success rest.,3/26/2025 16:10,Closed,Low
b5f85939-a111-45e5-b3e8-3cbafd900f54,Matthew Ortiz,rachelgriffin@example.com,(718)511-5753x27168,Internet not working,Wonder consumer off morning. Money year money finally interview society speech.,2/5/2025 3:44,In Progress,Low
d8cbfc2c-dd91-4aec-9f91-2830ef9cd823,Kenneth Kaufman,brownjoseph@example.org,(265)771-0431,Installation pending,Skin system final spend.,1/8/2025 23:31,Resolved,Critical
7509453f-5e9a-42c7-a7f7-92067713281c,David Ellison,orteganancy@example.net,001-412-294-5669,Connection drops,Strong with stage. Song staff eight memory wall care.,3/31/2025 11:41,Open,Critical
2e514bfb-6435-48c6-9e87-b9443708a694,Christopher Holmes,david78@example.org,(612)319-2651,Slow speed,Defense door show senior of issue back. Get daughter perhaps answer. Lay him man simply.,3/19/2025 9:37,Closed,High
891d00ba-bbaa-459c-891d-8abd3ed4c061,Douglas Mathis,maria35@example.com,001-246-872-0777,Disconnection issue,Consumer beat skill move table enjoy strong fill. Evidence beyond coach poor class country possible. Record nice mouth pass key left order.,3/14/2025 4:56,Resolved,Low
14bdb3c9-f4c3-4469-b0a3-f0e191fef63e,Gregory Graham,nicholas54@example.net,585-454-3811,Internet not working,Hundred west career oil scene expert political. Great himself thousand. Participant front skin in few himself heavy.,2/1/2025 2:33,Open,Low
f80dd13e-09ee-4a9a-a7fe-6593cefe4f69,Kristi Horn,richardrodriguez@example.net,001-332-549-0222,Connection drops,Task real probably man throw. Create herself hot all. Sure miss go up plan class structure.,3/5/2025 8:49,In Progress,High
21b9183a-620a-41a7-9eb8-2e5c8955c238,Jonathan Adams,nathan32@example.net,001-479-699-0002x7889,Billing issue,Clearly half all food. Somebody however whole stock southern.,1/25/2025 18:50,In Progress,High
b43b7816-f1b9-4259-a6c3-bb52eb0e7616,Brooke Allen,mvelez@example.org,001-284-230-1569x970,Billing issue,Western any property every option identify. Name country where note.,3/7/2025 21:32,Closed,Medium
af20e7cb-56b4-4735-8463-5b8c87e65fde,Amy Frey,kimlam@example.net,797.372.8552x8113,Internet not working,Election issue star decision. White live final. Other effort hit top.,6/5/2025 5:21,Closed,Low
9f96a029-8ebf-4f68-a8f5-43b4a0502cf7,Jennifer Aguilar,joseph74@example.org,597-688-6667,Wrong charges,Maintain it skill time role. Billion strategy method economy require. History nearly dark deal teacher million.,4/17/2025 1:54,In Progress,Medium
3ce820e9-ab2b-47cb-90d3-4b54426b62b5,Randy Peterson,cray@example.net,278-925-1371,Installation pending,Statement radio task hold. Father staff military. View year early somebody.,4/15/2025 23:06,Closed,Critical
5846fdf9-be7b-480e-8983-fc3b17ba7ed1,Jeremy Rogers,aterrell@example.net,496.292.9527,Billing issue,Follow be ask speech tell hand. Your result manage. Machine look official lawyer dream market need player.,4/13/2025 7:30,Resolved,Low
0af613b8-5096-430c-8ed9-4993941e5ce2,Michael Smith,tammy77@example.com,667-734-5476x3950,Customer support delay,Ok sound wait stock within. Few give clearly role summer network southern. Response gun must against line.,2/19/2025 19:26,Open,Medium
3332c5f5-7b4e-4442-8536-30adabd9df44,Colleen Wheeler,leealexandra@example.com,(609)253-9096,Customer support delay,Mind strategy player free bag treat. Early nearly form fire listen head. Site give rule Democrat simply.,4/16/2025 9:23,Open,Low
2d01e7a9-baf3-4b14-be6a-9039df9b17f6,Katherine Reed,ystephens@example.net,413.763.2973,Disconnection issue,Gas answer draw charge their. Guy drop final moment toward. Draw final specific ten.,4/9/2025 19:44,Resolved,Medium
79671437-13fa-4670-ad3e-df88f9a336d1,Ronald Gilmore,reynoldsjoshua@example.com,288.581.4058x58378,Disconnection issue,Energy through police into. Rise put as peace face. Charge people explain open only board arrive. Evidence speech discover good shake.,4/29/2025 2:53,In Progress,Critical
